"1","Direct criticism / feedback","This is wrong.","I think this needs to be reviewed more carefully."
"2","Direct criticism / feedback","Your work is sloppy.","I think the work could benefit from more attention to detail."
"3","Direct criticism / feedback","You did not understand the task.","I think the task may need to be revisited to avoid any misunderstanding."
"4","Direct criticism / feedback","This report is a mess.","This report needs to be reorganized and clarified."
"5","Direct criticism / feedback","You keep making the same mistake.","I have noticed the same issue recurring, so it may help to address it more systematically."
"6","Direct criticism / feedback","Your presentation was terrible.","I believe the presentation could benefit from additional structure and clearer key points."
"7","Direct criticism / feedback","This data is completely wrong.","I noticed some discrepancies in the data that I think are worth revisiting before we move forward."
"8","Direct criticism / feedback","You wasted everyone's time today.","I feel the session could have been more productive — perhaps we can refine the agenda for next time."
"9","Direct criticism / feedback","Your analysis is full of errors.","I have identified a few areas in the analysis that may need to be double-checked for accuracy."
"10","Direct criticism / feedback","That idea is ridiculous.","I appreciate the input, though I think we may need to explore this idea further before moving forward."
"11","Direct criticism / feedback","This is not what I asked for at all.","It seems there may have been a misunderstanding regarding the requirements — could we clarify the scope together?"
"12","Direct criticism / feedback","Your writing is unclear and confusing.","The writing could benefit from clearer structure and more concise phrasing to improve readability."
"13","Direct criticism / feedback","You failed to meet the basic requirements.","It appears some of the key requirements were not fully addressed — I would like to review them together to ensure alignment."
"14","Direct criticism / feedback","You made us look bad in front of the client.","I would like to discuss how we can better represent our team during client interactions going forward."
"15","Direct criticism / feedback","Your code is a disaster.","I noticed a few areas in the code that could be refactored for better readability and performance."
"16","Direct criticism / feedback","You ignored all my feedback.","I noticed that some of the earlier feedback may not have been incorporated — I would like to revisit those points if possible."
"17","Direct criticism / feedback","This design looks unprofessional.","I think the design could be elevated with some refinements to the layout and visual consistency."
"18","Direct criticism / feedback","You never follow through on anything.","I have noticed that some commitments have not been completed as planned — could we discuss how to address this?"
"19","Direct criticism / feedback","Your suggestions are always unhelpful.","I think your contributions could have more impact if they were more closely aligned with our current priorities."
"20","Direct criticism / feedback","You're doing everything wrong.","I think there are some areas of the process that could be approached differently to achieve better results."
"21","Direct criticism / feedback","Your feedback was useless.","I feel the feedback provided could be more specific and actionable to be truly helpful."
"22","Direct criticism / feedback","You have no attention to detail.","I think a more thorough review process could help us catch these types of issues before they progress further."
"23","Direct criticism / feedback","You gave the client the wrong information.","It appears some incorrect information may have been shared with the client — I would like to address this and put forward accurate details promptly."
"24","Direct criticism / feedback","Your tone in that email was rude.","I think the email's tone could be softened to better reflect our commitment to positive professional relationships."
"25","Direct criticism / feedback","You're always making excuses.","I think it would be more effective to focus on solutions rather than on the factors that led to the outcome."
"26","Direct criticism / feedback","Your slides are unreadable.","I think the slides could benefit from a clearer layout and improved visual hierarchy to better convey the key messages."
"27","Direct criticism / feedback","You set a bad example for the team.","I think it is important that we, as a team, model the standards and behaviours we expect from each other."
"28","Direct criticism / feedback","Your documentation is incomplete.","I noticed that some key sections of the documentation appear to be missing — could we prioritise completing those?"
"29","Direct criticism / feedback","You clearly didn't prepare for this meeting.","It seems there may have been limited time to prepare — perhaps we could reschedule to ensure everyone is ready."
"30","Direct criticism / feedback","Your performance this quarter was poor.","I would like to have a constructive conversation about performance this quarter and identify ways to support improvement going forward."
"31","Direct criticism / feedback","You contradicted yourself in the meeting.","I noticed some inconsistency in the points raised — it might help to align on our position before the next discussion."
"32","Direct criticism / feedback","Your project plan is unrealistic.","I believe the project plan would benefit from a more realistic assessment of timelines and resource requirements."
"33","Angry / demanding","Fix this right now or I'm going to management.","I would like to flag this as an urgent matter and would appreciate a prompt resolution before we consider further escalation."
"34","Angry / demanding","I'm furious. This is completely unacceptable.","I wanted to express that I am deeply concerned about the current situation and would like to discuss how we can address it constructively."
"35","Angry / demanding","Stop ignoring my messages!","I have attempted to reach you several times and would greatly appreciate a response at your earliest convenience."
"36","Angry / demanding","Do you even care about this project?","I would like to better understand your current level of engagement with the project and discuss how we can move forward together."
"37","Angry / demanding","This is your mess. Clean it up.","I believe ownership of resolving this issue would most appropriately sit with your team, and I would appreciate your prompt attention to it."
"38","Angry / demanding","I'm sick of dealing with this every week.","I have noticed this issue recurring regularly and would like to discuss a more permanent solution to prevent it going forward."
"39","Angry / demanding","You're making my job impossible.","I have encountered some significant challenges recently and would welcome a conversation about how we can better support each other."
"40","Angry / demanding","Why is nobody doing anything about this?","I would like to flag that this issue remains unresolved and would appreciate clarity on who is taking ownership of it."
"41","Angry / demanding","This is ridiculous. I want answers now.","I have some pressing questions about the current situation and would appreciate a timely response so we can move forward."
"42","Angry / demanding","I'm not putting up with this anymore.","I wanted to be transparent that I have reached a point where the current situation is no longer sustainable, and I would like to discuss how we can find a resolution."
"43","Angry / demanding","Someone needs to take responsibility for this disaster.","I believe it would be helpful to identify clear ownership of this issue so we can address it effectively and prevent recurrence."
"44","Angry / demanding","Stop being so difficult.","I would appreciate a more collaborative approach so we can make progress on this together."
"45","Angry / demanding","Nobody is taking this seriously!","I would like to flag that this matter requires greater attention and urgency from the team."
"46","Angry / demanding","I'm done being patient with this team.","I wanted to share that the pace of progress has been a source of frustration, and I would welcome a discussion about how we can improve our approach."
"47","Angry / demanding","Everyone here is incompetent.","I think there are some capability and process gaps worth addressing to improve the team's overall performance."
"48","Angry / demanding","Why do I have to do everything myself?","I would like to discuss how we can better distribute responsibilities to ensure the workload is shared more equitably."
"49","Angry / demanding","You've let everyone down. Again.","I wanted to acknowledge that the outcome fell short of expectations and discuss how we can ensure a different result going forward."
"50","Angry / demanding","If you can't do the job, say so.","I would appreciate an honest conversation about capacity and capability so we can ensure the right support is in place."
"51","Angry / demanding","You promised this months ago and nothing's happened.","A commitment was made several months ago that has yet to be fulfilled — I would like to discuss the current status and agree on a clear plan of action."
"52","Angry / demanding","You clearly don't respect anyone's time.","I feel our time could be used more effectively, and I would welcome a conversation about how we can better structure our interactions."
"53","Angry / demanding","This is the last straw.","I would like to address this matter directly, as it represents a critical point in our ability to maintain a productive working relationship."
"54","Angry / demanding","You've broken everything and now you're gone.","I have noticed some significant issues following recent changes and would appreciate support from your team in resolving them."
"55","Angry / demanding","I'm copying everyone on this so they can see what's happening.","For broader visibility, I have included relevant stakeholders on this communication to ensure appropriate oversight."
"56","Angry / demanding","This whole thing is a joke.","I believe the current approach requires significant reconsideration, and I would welcome the opportunity to discuss alternatives."
"57","Angry / demanding","You're always causing drama.","I have noticed some tension recently and would like to find a constructive way to address it together."
"58","Angry / demanding","I had to do it myself because you were too slow.","As the deadline was approaching, I took the liberty of completing this task — I would like to discuss how we can ensure timely delivery in future."
"59","Angry / demanding","Either sort this out or I quit.","I wanted to be candid — the current situation is having a serious impact on my ability to contribute effectively, and I would value a conversation about how we can address it."
"60","Angry / demanding","You made a promise and broke it.","I noticed that a commitment made earlier was not fulfilled — I would like to understand what happened and how we can prevent this going forward."
"61","Angry / demanding","Stop making decisions above your level.","I think it is important that we maintain a clear decision-making framework to ensure the right level of authority is applied."
"62","Angry / demanding","Nobody here has any integrity.","I believe reinforcing our professional values and holding each other accountable to them would strengthen the team's culture significantly."
"63","Angry / demanding","You just say what people want to hear.","I would value more candid feedback, as constructive honesty helps us make better decisions and grow."
"64","Angry / demanding","You're out of touch with the team.","I believe more regular engagement with the team would help ensure decisions are grounded in their day-to-day experience."
"65","Delay / late delivery","This is already three days late. What's going on?","I wanted to follow up on this deliverable, which is now three days past its due date. Could you please provide an update on the current status?"
"66","Delay / late delivery","You promised it by Friday. It's Monday now.","I noticed the agreed Friday deadline has passed — could you please advise on the current status and a revised completion date?"
"67","Delay / late delivery","Every single delivery from your team is late.","I have noticed a recurring pattern of delays from the team and would like to discuss how we can improve delivery reliability going forward."
"68","Delay / late delivery","Why didn't you warn me this was going to be late?","I would appreciate earlier communication when delays are anticipated, as it allows us to plan accordingly and manage stakeholder expectations."
"69","Delay / late delivery","The client is asking where their order is and I have nothing to tell them.","The client has been in touch regarding the status of their order, and I would appreciate an urgent update so I can respond to them promptly."
"70","Delay / late delivery","Your delays are killing our project timeline.","The cumulative delays are having a significant impact on our overall project schedule, and I would like to discuss how we can recover the timeline."
"71","Delay / late delivery","Stop making excuses and just deliver.","I would appreciate a clear commitment on the delivery date and a plan to ensure we meet it, rather than continuing to revisit the reasons for the delay."
"72","Delay / late delivery","I'm tired of hearing 'almost ready'.","I would welcome a specific and confirmed completion date rather than a general status update, so we can plan accordingly."
"73","Delay / late delivery","You've delayed this project by a full month.","The project is now running approximately one month behind schedule — I would like to discuss the contributing factors and agree on a recovery plan."
"74","Delay / late delivery","This delay is going to cost us the client.","I am concerned that the current delay may put our client relationship at risk and would like to discuss how we can address it urgently."
"75","Delay / late delivery","We've been waiting two weeks for something that should take two days.","This task has been outstanding for significantly longer than anticipated — could we discuss what has caused the delay and how we can accelerate completion?"
"76","Delay / late delivery","Your team's delays are affecting my KPIs.","The delays from your team are having a direct impact on my performance metrics, and I would appreciate a conversation about how we can resolve this."
"77","Delay / late delivery","This is not the first time you've been late. It's a habit.","I have noticed a consistent pattern of late delivery and would like to have a constructive conversation about how we can address this systematically."
"78","Delay / late delivery","The board is waiting and you're still not ready.","The board is expecting this material, and I would like to understand the current status and estimated completion time as a matter of priority."
"79","Delay / late delivery","You knew the deadline and you still missed it.","Despite the deadline being clearly communicated, this item was not delivered on time — I would like to understand what happened and how we prevent a recurrence."
"80","Delay / late delivery","Everything is blocked because of you.","Several workstreams are currently on hold pending this deliverable — I would appreciate your urgent attention to unblocking them."
"81","Delay / late delivery","We've pushed this deadline three times already.","This is the third time the deadline has been revised — I would like to agree on a firm and final date and ensure we have the right support in place to meet it."
"82","Delay / late delivery","This delay is unprofessional and unacceptable.","I would like to address this delay directly, as it falls below the standard we expect and has had a significant impact on our delivery commitments."
"83","Delay / late delivery","If it's not here by noon I'm escalating.","I would appreciate receiving this by noon today — if that is not achievable, please let me know immediately so we can consider next steps."
"84","Delay / late delivery","You had all the resources and still couldn't deliver on time.","Despite having the necessary resources available, this was not delivered on time — I would like to understand the challenges faced and how we can address them."
"85","Delay / late delivery","You told me last week it was done. It clearly isn't.","I understood from our last conversation that this had been completed, though it appears there are still outstanding items — could we clarify the current status?"
"86","Delay / late delivery","When exactly is this coming? Give me a real answer.","Could you please provide a specific and confirmed delivery date so I can update the relevant stakeholders accordingly?"
"87","Delay / late delivery","This was supposed to ship last week. Still nothing.","The shipment was expected last week and has not yet been received — could you please provide an update on the expected delivery date?"
"88","Delay / late delivery","Your slowness is dragging down the team.","I would like to discuss how we can support you in meeting delivery expectations more consistently, as it is affecting the broader team's progress."
"89","Delay / late delivery","We were almost fined because of your delay.","I wanted to highlight the seriousness of this situation — the delay almost resulted in a financial penalty, which we must ensure does not happen again."
"90","Delay / late delivery","You've caused a knock-on effect for three other teams.","I wanted to highlight that the delay on this item is now affecting the timelines of several other teams and would like to discuss how we can address this."
"91","Delay / late delivery","The release is tomorrow and this isn't done.","With tomorrow's release approaching, this outstanding item is now critical — I would like to agree on a plan to have it completed today."
"92","Delay / late delivery","You're going to make us miss the launch.","I am concerned that the current delays may put our launch date at risk — could we convene urgently to discuss the options?"
"93","Delay / late delivery","We needed this first thing this morning.","This item was expected early this morning — could you please provide an update on its status?"
"94","Delay / late delivery","You've wasted a whole quarter.","I would like to have a frank discussion about the outcomes this quarter and what we need to do differently to make meaningful progress in the next."
"95","Delay / late delivery","Every hour you delay this costs us more.","I would like to flag the time-sensitive financial impact of the current delay and request that this be addressed as an immediate priority."
"96","Delay / late delivery","You made us lose the contract because of your delays.","I wanted to address the serious impact of the recent delays, which have unfortunately affected our contractual relationship — I would like to discuss how we prevent this going forward."
"97","Clarification / information request","What does this even mean? It makes no sense.","I wanted to flag that this point is not entirely clear to me — could you please provide some additional context or clarification?"
"98","Clarification / information request","Nobody explained anything to me. I'm completely lost.","I would appreciate some additional guidance on this, as I do not yet have full clarity on the expectations or process."
"99","Clarification / information request","Why are we doing this? Nobody has told us anything.","I would welcome a clearer explanation of the rationale behind this initiative to help the team engage with it more meaningfully."
"100","Clarification / information request","This brief is completely useless.","I think the brief could benefit from greater detail and clarity — could we schedule time to walk through the key requirements together?"
"101","Clarification / information request","I have no idea what I'm supposed to do with this.","Could you please provide some additional guidance on the expected outcome and my specific responsibilities in relation to this task?"
"102","Clarification / information request","The instructions are impossible to follow.","I am finding the current instructions difficult to action — could we clarify a few key points to ensure I am able to proceed correctly?"
"103","Clarification / information request","Nobody told me the specs changed.","I wanted to flag that I was not informed of the specification changes — could you please share the updated requirements so I can adjust accordingly?"
"104","Clarification / information request","This email makes absolutely no sense.","I would appreciate some clarification on the points raised in this email to ensure I have a clear understanding before responding."
"105","Clarification / information request","What exactly do you want from me?","Could you help me understand what specific outcomes or deliverables are expected from me on this?"
"106","Clarification / information request","You keep changing what you want and it's driving me mad.","I have noticed the requirements have been revised several times, which has made it challenging to maintain a clear direction — could we agree on a final version?"
"107","Clarification / information request","Stop being so vague.","I would appreciate more specific guidance so I can action this effectively and ensure the output meets your expectations."
"108","Clarification / information request","I don't know what success looks like for this project.","Could you help clarify the key success criteria for this project so the team can align their efforts accordingly?"
"109","Clarification / information request","Nobody's told me who's responsible for what.","I would appreciate a clear breakdown of roles and responsibilities to ensure everyone knows what is expected of them."
"110","Clarification / information request","What's the actual deadline? People keep saying different things.","I have received some conflicting information regarding the deadline and would appreciate confirmation of the correct date."
"111","Clarification / information request","Are we even aligned on the goal here?","I wanted to check that we have a shared understanding of the objective — could we take a moment to confirm our alignment?"
"112","Clarification / information request","I have no clue what happened in that meeting.","I would appreciate a brief summary of the key outcomes and action points from the meeting, as I am unclear on what was agreed."
"113","Clarification / information request","The scope keeps changing and nobody tells us.","I have noticed the project scope has been revised without consistent communication to the team — I would appreciate a formal update whenever changes are made."
"114","Clarification / information request","This document is full of jargon I don't understand.","I found some of the terminology in this document unclear — could you help clarify a few key terms so I can fully engage with the content?"
"115","Clarification / information request","This process makes zero sense.","I would welcome a walkthrough of this process to ensure I have a clear understanding of each step and its purpose."
"116","Clarification / information request","Nobody told me there was a change in direction.","I would appreciate being informed of strategic changes as they occur so I can adjust my work accordingly."
"117","Clarification / information request","I keep getting contradictory information from different people.","I have received conflicting guidance from different sources and would appreciate a single point of clarity to ensure I am working from the correct information."
"118","Clarification / information request","Why wasn't I included in that decision?","I would appreciate understanding the reasoning behind my exclusion from this decision, as I believe I could have contributed valuable input."
"119","Clarification / information request","I still don't understand what this project is trying to achieve.","Could we arrange a brief session to clarify the project's core objectives so the team has a shared and clear understanding of what we are working towards?"
"120","Clarification / information request","What are we actually measuring here?","I would appreciate clarity on the key metrics and KPIs we are using to evaluate success on this project."
"121","Clarification / information request","Nobody tells us anything until the last minute.","I would appreciate more timely communication on important updates so the team has adequate time to prepare and respond effectively."
"122","Clarification / information request","I can't find the latest version of this document anywhere.","Could you please share the most current version of this document and advise on where it is being stored for future reference?"
"123","Clarification / information request","Who approved this? Nobody told me.","Could you please confirm who authorised this decision and when, so I have the full context?"
"124","Clarification / information request","What's the budget for this? Nobody has shared it.","Could you please share the approved budget for this project so the team can plan and make decisions accordingly?"
"125","Clarification / information request","I don't even know which version of the plan we're following.","Could you please confirm which version of the project plan is current so the team can align their work accordingly?"
"126","Clarification / information request","Nobody has explained the new policy to us.","I would appreciate a clear overview of the new policy and its implications for our team so we can ensure full compliance."
