"370","Meetings / presentations","The meeting notes were never distributed.","I would appreciate meeting notes being shared promptly after each session so participants have a clear record of what was discussed and agreed."
"371","Meetings / presentations","You showed up to the board meeting unprepared.","I believe thorough preparation for board-level presentations is essential — I would like to discuss how we can better support this going forward."
"372","Meetings / presentations","Your presentation had no supporting evidence.","I think the presentation would be significantly strengthened by including relevant data and evidence to support the key points."
"373","Meetings / presentations","That meeting achieved absolutely nothing.","I believe we could improve the productivity of our meetings by setting clearer objectives and ensuring each session has a defined outcome."
"374","Meetings / presentations","You used the wrong version of the slides.","I noticed the presentation used an earlier version of the slides — could you please share the correct version for the record?"
"375","Meetings / presentations","People were on their phones the entire meeting.","I believe refocusing the meeting format to be more engaging and relevant would help improve attention and participation."
"376","Meetings / presentations","You spoke over the client the whole time.","I would appreciate ensuring the client has ample opportunity to speak in our meetings, as it is essential for building a positive relationship."
"377","Meetings / presentations","The meeting ran with no facilitator and it was chaos.","I believe designating a clear facilitator for each meeting would help maintain focus and ensure productive outcomes."
"378","Meetings / presentations","Your slides had spelling mistakes throughout.","I noticed a number of spelling errors in the presentation — I would recommend a thorough proofread before these are shared externally."
"379","Meetings / presentations","Nobody brought the right people to that meeting.","I believe ensuring the right stakeholders are present would make our meetings considerably more effective and better informed."
"380","Meetings / presentations","You changed the presentation the night before.","I would appreciate changes to key materials being made with sufficient lead time to allow for review before the presentation."
"381","Meetings / presentations","The presentation was way too technical for the audience.","I think tailoring the level of technical detail to the audience would make the presentation more accessible and impactful."
"382","Meetings / presentations","Nobody followed up on the actions from last meeting.","I would suggest reviewing the outstanding actions from our previous meeting at the start of each session to ensure accountability and follow-through."
"383","Meetings / presentations","You scheduled the most important meeting at the worst possible time.","I would appreciate the timing of key meetings being considered more carefully to maximise attendance and engagement from all relevant parties."
"384","Meetings / presentations","The meeting was called at the last minute and nobody was ready.","I would appreciate more advance notice for meetings, particularly important ones, so participants have adequate time to prepare."
"385","Problem escalation / risk","This is a disaster waiting to happen and nobody cares.","I would like to flag a significant risk that I believe requires urgent attention before it escalates further."
"386","Problem escalation / risk","I've been raising this issue for months and nothing's been done.","I have escalated this concern on multiple occasions without resolution — I would appreciate this being treated as a priority and actioned promptly."
"387","Problem escalation / risk","This is going to blow up and I warned you.","I want to formally document that I raised this risk previously and reiterate the importance of addressing it before it causes further impact."
"388","Problem escalation / risk","You're hiding problems instead of solving them.","I believe transparent communication about challenges is essential — I would encourage a more open approach to flagging and addressing issues."
"389","Problem escalation / risk","Nobody ever escalates anything until it's a crisis.","I would like to propose a more proactive approach to risk identification and escalation to help us manage issues before they become critical."
"390","Problem escalation / risk","This problem has been swept under the rug for too long.","I would like to bring this long-standing issue formally to the table and discuss a plan to address it comprehensively."
"391","Problem escalation / risk","You keep downplaying serious risks.","I would like to ensure that significant risks receive the level of attention they warrant in our planning and reporting."
"392","Problem escalation / risk","I'm escalating this because nobody at this level is listening.","As this matter has not been resolved at the current level, I am escalating it to ensure it receives appropriate attention."
"393","Problem escalation / risk","This is a compliance issue and you're ignoring it.","I wanted to flag that this matter may have compliance implications and I believe it warrants urgent and formal attention."
"394","Problem escalation / risk","The risk register hasn't been updated in months.","I would like to raise that the risk register appears to be out of date and would appreciate a review to ensure it accurately reflects the current situation."
"395","Problem escalation / risk","You raised the red flag too late.","I wanted to discuss the timing of this escalation, as earlier identification would have given us more options to manage the situation."
"396","Problem escalation / risk","This is going to have serious legal consequences.","I would like to flag that this matter may carry legal implications and recommend we seek appropriate guidance before proceeding."
"397","Problem escalation / risk","Nobody here takes risk management seriously.","I believe embedding a stronger risk management culture would significantly improve our ability to anticipate and respond to challenges."
"398","Problem escalation / risk","You signed off on something without checking the risks.","I wanted to flag that a formal risk assessment does not appear to have been completed prior to sign-off — I would like to ensure this is addressed."
"399","Problem escalation / risk","I had to find out about this crisis from the news.","I was not informed of this issue through internal channels — I would appreciate a review of our crisis communication protocols."
"400","Problem escalation / risk","You knew about this risk and said nothing.","I wanted to raise that awareness of this risk existed prior to escalation — I would like to discuss how we improve our reporting culture going forward."
"401","Problem escalation / risk","This issue was flagged last quarter and still isn't fixed.","I wanted to revisit an issue that was raised last quarter and remains unresolved — I would like to agree on a concrete plan to address it."
"402","Problem escalation / risk","Nobody owns the risk log and it's a mess.","I believe assigning clear ownership of the risk log and establishing a regular review cadence would significantly strengthen our risk management approach."
"403","Problem escalation / risk","You escalated to the wrong people and wasted everyone's time.","I would suggest clarifying our escalation pathways to ensure the right stakeholders are engaged at the appropriate level."
"404","Problem escalation / risk","This has reputational risk written all over it.","I would like to flag that this situation poses a potential reputational risk and recommend we involve the relevant teams to manage it carefully."
"405","Problem escalation / risk","The issue is getting worse because nobody acted on it.","I am concerned that inaction has allowed this issue to deteriorate — I would like to agree on an immediate set of corrective actions."
"406","Problem escalation / risk","You buried the risk in the report where nobody would see it.","I believe significant risks should be clearly highlighted in our reporting so they receive the visibility and attention they require."
"407","Problem escalation / risk","We have no contingency plan and it's terrifying.","I would like to prioritise developing a contingency plan for this scenario, as the current absence of one poses a significant operational risk."
"408","Problem escalation / risk","You escalated way too early and caused unnecessary panic.","I would encourage a more measured approach to escalation, ensuring issues are properly assessed before being raised more widely."
"409","Problem escalation / risk","This problem keeps coming back because we never fix the root cause.","I believe addressing the root cause of this recurring issue is essential — I would like to propose a structured review to identify and resolve it permanently."
"410","Problem escalation / risk","Nobody told the client about the risk and now they're furious.","I believe proactive communication with clients about known risks is essential — I would like to discuss how we can improve our approach going forward."
"411","Problem escalation / risk","You closed the risk before it was actually resolved.","I noticed this risk was marked as closed before a full resolution was in place — I would recommend keeping it open until the mitigation is confirmed."
"412","Problem escalation / risk","This escalation has been ignored at every level.","I wanted to formally record that this escalation has not been actioned and would like to request that it be addressed as an immediate priority."
"413","Problem escalation / risk","We're always reactive instead of proactive with risks.","I believe shifting to a more proactive risk identification and management approach would significantly reduce the frequency and impact of issues."
"414","Problem escalation / risk","You created a new risk by trying to fix the first one.","I wanted to flag that the mitigation action taken may have introduced an additional risk — I would appreciate a review before we proceed further."
"415","Problem escalation / risk","This risk has financial implications nobody has quantified.","I believe it is important to quantify the financial implications of this risk so we can make an informed decision about how to respond."
"416","Problem escalation / risk","You don't have a process for handling incidents like this.","I would recommend establishing a clear incident management process to ensure we can respond to situations like this in a structured and consistent way."
"417","Learning / training","That training was a complete waste of time.","I believe the training session could be redesigned to be more practically focused and directly applicable to our day-to-day work."
"418","Learning / training","Nobody teaches us anything here.","I would appreciate greater investment in structured learning and development opportunities for the team."
"419","Learning / training","You expect us to know things we've never been taught.","I would appreciate clearer guidance and training on the relevant processes and tools before being expected to apply them independently."
"420","Learning / training","The onboarding was a joke.","I believe the onboarding programme would benefit from a thorough review to ensure new team members are set up for success from the start."
"421","Learning / training","Nobody gave me any induction and now I'm lost.","I wanted to flag that I did not receive a formal induction and would appreciate some structured support to get up to speed."
"422","Learning / training","Stop throwing people in at the deep end.","I think a more structured approach to bringing team members up to speed would help them contribute more effectively and reduce errors."
"423","Learning / training","That trainer had no idea what they were doing.","I believe the training could benefit from being delivered by someone with more direct experience in the subject matter."
"424","Learning / training","We're expected to learn everything on our own.","I would appreciate more formalised support for professional development rather than relying solely on self-directed learning."
"425","Learning / training","The training materials are completely out of date.","I noticed that the training materials do not reflect current processes — I would recommend a review to ensure they are accurate and up to date."
"426","Learning / training","Nobody follows up after training so nothing changes.","I believe reinforcing training with structured follow-up and practical application would significantly improve knowledge retention."
"427","Learning / training","Why are we doing the same training for the third year in a row?","I would suggest reviewing our training programme to ensure it continues to evolve in line with the team's current development needs."
"428","Learning / training","The workshop was too theoretical and had no practical value.","I believe a more hands-on, practical approach would make the workshop more immediately applicable and impactful."
"429","Learning / training","Nobody told me there was mandatory training due.","I would appreciate advance notice of mandatory training requirements so I can plan my schedule accordingly."
"430","Learning / training","You expect us to perform tasks we haven't been trained on.","I would appreciate access to the appropriate training before being assigned tasks that require specific knowledge or skills."
"431","Learning / training","Our development plans are just box-ticking exercises.","I believe our development planning process could be made more meaningful with clearer goals, regular reviews, and genuine investment in growth."
"432","Learning / training","Nobody mentors junior staff here.","I believe establishing a structured mentoring programme would greatly benefit the development of junior team members and strengthen the team overall."
"433","Learning / training","The learning platform is broken and nobody has fixed it.","I wanted to flag that the learning platform is not functioning correctly, which is preventing team members from completing required training."
"434","Learning / training","You trained the wrong people.","I think it would be worth reviewing who is included in training sessions to ensure the right people receive the relevant development."
"435","Learning / training","The training doesn't reflect how we actually work.","I believe the training content would be more effective if it were better aligned with our actual processes and day-to-day working practices."
"436","Learning / training","We were given no time to practise before going live.","I would appreciate adequate time for practice and consolidation before being expected to apply new skills in a live environment."
"437","Learning / training","The trainer rushed through everything.","I believe the training would benefit from a more measured pace to allow participants to fully absorb and retain the content."
"438","Learning / training","Nobody assessed whether the training actually worked.","I would recommend implementing a post-training evaluation process to measure the effectiveness of our learning programmes and identify areas for improvement."
"439","Learning / training","You cancelled the training at the last minute with no explanation.","I would appreciate more notice when training sessions are cancelled, along with a confirmed reschedule date to avoid disruption to development plans."
"440","Learning / training","The training assumes knowledge we don't have.","I believe the training could benefit from a more accessible starting point that does not assume prior knowledge the team may not have."
"441","Learning / training","Nobody applies what they learn in training.","I believe bridging the gap between training content and practical application would significantly improve the return on our learning investment."
"442","Learning / training","You invest in training for the wrong skills.","I would welcome a more structured needs assessment to ensure our training investment is directed at the skills that will have the greatest impact."
"443","Learning / training","I wasn't informed about the new system until the day it launched.","I would appreciate earlier communication about system changes, along with adequate training time before go-live."
"444","Learning / training","The training was irrelevant to my role.","I would appreciate a more tailored approach to training that reflects the specific requirements and responsibilities of my role."
"445","Learning / training","Nobody gives us feedback on our development progress.","I would appreciate more regular and specific feedback on my development to help me understand where I am progressing and where I need to focus."
"446","Learning / training","The e-learning module took four hours and taught me nothing.","I believe the e-learning content could be significantly condensed and made more targeted to improve its value and the time investment required."
"447","Learning / training","We're expected to develop ourselves with no budget or support.","I would appreciate greater organisational support for professional development, including access to appropriate resources and time to invest in learning."
"448","Learning / training","Training is always the first thing cut when budgets are tight.","I believe consistent investment in learning and development is essential for long-term team performance and should be protected even during budget pressures."
"449","Email openings / closings","Just sending this again since you obviously ignored it.","I wanted to follow up on my previous message and kindly check whether you had the opportunity to review it."
"450","Email openings / closings","Why haven't you responded yet?","I hope this message finds you well. I wanted to check in regarding my earlier email and see if you require any further information."
"451","Email openings / closings","Read this properly this time.","Please find the updated information below. I hope this provides the clarity needed to move forward."
"452","Email openings / closings","As I already said...","To build on the points raised in my previous communication, I wanted to provide some additional context."
"453","Email openings / closings","I'm done being ignored.","I wanted to reach out once more, as I believe this matter requires prompt attention and I would appreciate your response."
"454","Email openings / closings","This is my third time asking.","I am following up for the third time and would greatly appreciate a response at your earliest convenience."
"455","Email openings / closings","Pay attention to this one.","Please note the key points below, which I believe are important for our next steps."
"456","Email openings / closings","FYI since no one tells me anything.","I wanted to keep you informed of the following update, which I believe is relevant to your work."
"457","Email openings / closings","Reply this time, please.","I look forward to hearing from you at your earliest convenience."
"458","Email openings / closings","Don't ignore this like the last one.","I wanted to follow up on my previous email and kindly request a response when you have the opportunity."
"459","Email openings / closings","I've been waiting forever for a reply.","I wanted to follow up on my previous email, as I have not yet received a response and would appreciate one when you have a moment."
"460","Email openings / closings","Just deal with this already.","I would appreciate it if this matter could be addressed at the earliest possible opportunity."
"461","Email openings / closings","Since you haven't done anything about it.","I wanted to follow up on this item, as it remains unresolved and is becoming time-sensitive."
"462","Email openings / closings","Fine, have it your way.","I respect your position on this and will proceed accordingly. Please let me know if anything changes."
"463","Email openings / closings","Not my problem anymore.","I have noted your decision and will update the relevant stakeholders accordingly. Please do not hesitate to reach out if further input is needed."
"464","Email openings / closings","I give up trying to explain this.","I hope the information below provides some additional clarity. I am happy to discuss further if needed."
"465","Email openings / closings","This is your last chance to respond.","I would appreciate a response by the end of this week to ensure we can proceed without further delay."
"466","Email openings / closings","Bumping this because no one cares apparently.","I wanted to gently follow up on the below to ensure it is still on your radar."
"467","Email openings / closings","Emailing again because somehow this is still unresolved.","I am reaching out once more, as this matter remains outstanding and I would appreciate your assistance in resolving it."
"468","Email openings / closings","As per my LAST email.","As outlined in my previous message, I wanted to kindly follow up on the points raised."
"469","Email openings / closings","I'll be escalating if I don't hear back.","Please note that should I not receive a response by the agreed date, I may need to escalate this matter to ensure timely resolution."
"470","Email openings / closings","Copying management since this is going nowhere.","For visibility, I have included the relevant manager on this correspondence to ensure appropriate oversight."
"471","Email openings / closings","Thanks for nothing, as usual.","Thank you for your time on this matter. I hope we can work together to reach a constructive resolution going forward."
"472","Email openings / closings","Last email from me on this, do what you want.","I wanted to provide one final update on this matter. I trust you will take the appropriate next steps and I remain available should you need any further input."
"473","Email openings / closings","Sending this because nobody reads Slack.","I hope this email finds you well. I wanted to share the following update and would appreciate your acknowledgment when convenient."
"474","Email openings / closings","Not sure why I'm even writing this.","I hope this message is helpful. Please find the relevant details below and feel free to reach out if you have any questions."
"475","Email openings / closings","Chasing this AGAIN since apparently emails disappear.","I am following up on my previous email, which I believe may not have reached you. I would appreciate a response at your earliest convenience."
"476","Email openings / closings","Since you won't pick up the phone.","I hope this email reaches you. I have been attempting to connect and wanted to follow up in writing to ensure this matter is addressed."
"477","Email openings / closings","This is your problem, I'm just forwarding it.","I am forwarding the below for your awareness and would appreciate your guidance on the most appropriate next steps."
"478","Email openings / closings","If anyone actually cares, here's the latest.","I hope this update is useful. Please find the latest information below and do not hesitate to reach out if you require any clarification."
"479","Email openings / closings","Not holding my breath but here goes.","I hope the below addresses your query and I look forward to your response."
"480","Email openings / closings","Forwarding again in case you lost it.","I wanted to resend the below communication for your reference in case it was not received previously."
"481","General diplomacy","I don't agree with this decision at all.","I understand where the decision is coming from, though I do have some reservations I would like to share for consideration."
"482","General diplomacy","You're wrong about this.","I see this from a slightly different perspective and would welcome the opportunity to discuss our respective views."
"483","General diplomacy","That will never work.","I think there are some practical challenges worth considering before we move forward with this approach."
"484","General diplomacy","Stop micromanaging me.","I feel I work most effectively when given the space to manage my work independently — I would appreciate discussing how we can find the right balance."
"485","General diplomacy","This is your problem, not mine.","While this may fall outside my direct area of responsibility, I am happy to support in any way that helps us resolve it."
"486","General diplomacy","You always take the credit.","I believe recognising individual contributions more explicitly would strengthen team morale and trust."
"487","General diplomacy","Stop changing things without telling anyone.","I think greater communication around changes would help ensure everyone is aligned and transitions go more smoothly."
"488","General diplomacy","You're playing favourites.","I would like to have an open conversation about how decisions are made to ensure the process is transparent and equitable for everyone."
"489","General diplomacy","That's not fair.","I feel the current approach may not be entirely equitable — I would welcome a conversation about how we can address that."
"490","General diplomacy","Why are we wasting time on this?","I would like to understand the strategic value of this initiative to ensure we are directing our efforts where they will have the most impact."
"491","General diplomacy","Nobody tells me anything around here.","I would appreciate being kept more informed of relevant updates and decisions to ensure I can contribute effectively."
"492","General diplomacy","You always dismiss my input.","I feel my contributions could be more fully considered in our discussions — I would welcome feedback on how to make my input more impactful."
"493","General diplomacy","This is going nowhere.","I think we may benefit from refocusing the conversation and agreeing on a clear next step."
