"250","Team collaboration","You keep changing the agreed approach without telling anyone.","I would appreciate being informed when the agreed approach is revised, so the team can stay aligned and plan accordingly."
"251","Team collaboration","I'm always left out of the loop.","I would appreciate being included in relevant communications and discussions so I can stay informed and contribute meaningfully."
"252","Team collaboration","The team dynamic is toxic.","I believe there are some interpersonal and cultural dynamics within the team that would benefit from open and constructive discussion."
"253","Team collaboration","You always take the loudest voice instead of the best idea.","I would encourage a more structured approach to evaluating ideas based on their merit rather than on how confidently they are presented."
"254","Team collaboration","Nobody follows up on what we agree in team meetings.","I would suggest assigning clear owners and deadlines to action points in team meetings to ensure they are followed through."
"255","Team collaboration","You never acknowledge other people's contributions.","I believe more consistent recognition of individual contributions would strengthen team morale and reinforce a culture of collaboration."
"256","Team collaboration","We never celebrate wins as a team.","I would love to see us take more time to recognise and celebrate our collective achievements, as it is important for team cohesion and motivation."
"257","Progress / status updates","Why am I finding out about this from someone else?","I would appreciate being kept informed directly on this matter, rather than learning about it through other channels."
"258","Progress / status updates","You've given me zero updates in two weeks.","I wanted to check in, as I have not received a progress update in two weeks and would appreciate a brief summary of where things stand."
"259","Progress / status updates","I have no idea where this project is.","I would appreciate a status update on the project to ensure I have full visibility of current progress and any outstanding items."
"260","Progress / status updates","Your status reports are useless.","I believe our status reports could be strengthened with more specific progress indicators and clearer information on risks and next steps."
"261","Progress / status updates","You promised weekly updates and haven't sent any.","I wanted to follow up on the weekly updates we agreed upon, as I have not yet received any since our discussion."
"262","Progress / status updates","Nobody tells us what's actually happening.","I would appreciate more transparent and regular communication about progress so the team can stay informed and aligned."
"263","Progress / status updates","You always say 'in progress' but nothing ever moves.","I would welcome a more specific update on progress, including any blockers that may be preventing advancement."
"264","Progress / status updates","Why do I have to keep asking for updates?","I would appreciate a more proactive approach to sharing updates, so regular follow-up is not required."
"265","Progress / status updates","The project dashboard hasn't been updated in a month.","I noticed the project dashboard has not been updated recently — could you please ensure it reflects the current status?"
"266","Progress / status updates","You told me it was 90% done last week. Where's the other 10%?","I understood from our last conversation that this was nearly complete — could you provide an update on the remaining items and an expected completion date?"
"267","Progress / status updates","I feel like I'm in the dark on everything.","I would appreciate more regular and proactive updates to ensure I have the visibility I need to support the team effectively."
"268","Progress / status updates","Stop giving me vague updates.","I would appreciate more specific and quantifiable progress updates so I can accurately report to stakeholders."
"269","Progress / status updates","Nothing has moved in three weeks.","I wanted to flag that there has been no visible progress on this item for three weeks and would like to discuss how to unblock it."
"270","Progress / status updates","You never flag risks until it's too late.","I would appreciate earlier identification and communication of risks so we have adequate time to develop mitigation strategies."
"271","Progress / status updates","The update you gave was completely out of date.","I believe the update shared may not reflect the current situation — could you please provide the most recent status?"
"272","Progress / status updates","How is this still at zero percent?","I would like to understand what obstacles are preventing progress on this item and discuss what support might be needed."
"273","Progress / status updates","You gave me a status report with no actual information.","I think the status report could benefit from more specific data on milestones, completion rates, and any outstanding blockers."
"274","Progress / status updates","Everyone gives different updates on the same project.","I would suggest aligning on a single source of truth for project updates to ensure consistent information is shared across the team."
"275","Progress / status updates","Why is progress tracking such a mess?","I believe introducing a more structured approach to progress tracking would give the team and stakeholders much clearer visibility."
"276","Progress / status updates","I don't even know who's working on what.","I would appreciate a clearer overview of task ownership and current priorities within the team."
"277","Progress / status updates","I had to find out the project was delayed from the client.","I wanted to flag that I learned of the project delay through the client rather than internally — I would appreciate being informed of such developments directly and promptly."
"278","Progress / status updates","Your updates are always too late to be useful.","I would appreciate receiving updates in a more timely manner so they can inform decisions before they are no longer relevant."
"279","Progress / status updates","Nobody tracks progress around here.","I believe implementing a consistent progress tracking framework would help the team maintain accountability and visibility across all workstreams."
"280","Progress / status updates","You report green when everything is clearly red.","I would encourage more accurate and transparent status reporting, as it is essential for effective risk management and stakeholder trust."
"281","Progress / status updates","The milestones keep moving and nobody announces it.","I would appreciate formal communication whenever project milestones are revised, so all stakeholders can adjust their plans accordingly."
"282","Progress / status updates","I never know if we're on track or not.","I would welcome a clearer and more regular progress communication that gives an honest picture of where we stand against our targets."
"283","Progress / status updates","Your last update had wrong data in it.","I noticed some inaccuracies in the most recent update — could you please share a corrected version at your earliest convenience?"
"284","Progress / status updates","Nobody sends updates unless I chase them.","I would appreciate a more proactive cadence of updates so I do not need to follow up each time."
"285","Progress / status updates","The project is behind and you haven't told anyone.","I would like to flag that the project appears to be running behind schedule, and I believe stakeholders should be informed promptly so we can agree on a recovery plan."
"286","Progress / status updates","You only share good news and hide the problems.","I believe transparent reporting that includes both progress and challenges is essential for effective project management and stakeholder confidence."
"287","Progress / status updates","I have no visibility into what your team is doing.","I would appreciate regular updates from your team on their workstreams so I can maintain an accurate picture of overall progress."
"288","Progress / status updates","You cancelled the status meeting and didn't reschedule it.","I noticed the status meeting was cancelled without a follow-up date — could we please reschedule it at the earliest opportunity?"
"289","Quality / accuracy","This is full of errors. Did you even check it?","I noticed a number of errors in this document — I would appreciate a thorough review before the next version is submitted."
"290","Quality / accuracy","Your quality has been terrible lately.","I have noticed the quality of recent outputs has not been at the standard we expect, and I would like to discuss how we can address this together."
"291","Quality / accuracy","This is not fit for purpose.","I believe the current output does not fully meet the required standard — I would like to work with you on the changes needed."
"292","Quality / accuracy","You sent the client a document full of typos.","I wanted to flag that the document shared with the client contained some errors — I would like to discuss how we can strengthen our review process going forward."
"293","Quality / accuracy","This is below the quality we agreed on.","The quality of this deliverable falls short of the agreed standard, and I would appreciate a revised version that meets the original brief."
"294","Quality / accuracy","The numbers in this report are wrong. Again.","I have identified some inaccuracies in the report figures — I would appreciate a corrected version and a review of how these errors occurred."
"295","Quality / accuracy","You're rushing and it shows.","I believe slowing down and applying greater care to the review process would significantly improve the quality of the final output."
"296","Quality / accuracy","Did anyone actually review this before sending?","I would like to confirm whether a quality review was conducted before this was distributed, as I have noticed some issues that should have been caught."
"297","Quality / accuracy","This wouldn't pass even a basic review.","I have significant concerns about the quality of this work and would like to discuss what support is needed to bring it to the required standard."
"298","Quality / accuracy","The data is inaccurate and you submitted it anyway.","I understand there may have been time pressure, but submitting inaccurate data carries significant risk — I would like to discuss how we address this."
"299","Quality / accuracy","Every deliverable from you needs to be redone.","I have noticed that a significant proportion of deliverables require revision — I would like to identify the root cause and put measures in place to improve first-time quality."
"300","Quality / accuracy","Your proofreading is non-existent.","I would appreciate more thorough proofreading before documents are submitted or shared externally."
"301","Quality / accuracy","This looks like a first draft, not a finished product.","I feel this document would benefit from additional refinement before it is ready for its intended audience."
"302","Quality / accuracy","You're producing quantity over quality and it's damaging us.","I believe we would benefit from refocusing our efforts on quality rather than volume, as the current approach is affecting our overall output standard."
"303","Quality / accuracy","Your work doesn't meet basic standards.","I believe this work would benefit from greater attention to the core quality standards we have established."
"304","Quality / accuracy","You approved something that wasn't ready.","I wanted to flag that the item approved does not appear to have met the required criteria — I would like to discuss our review process to prevent this going forward."
"305","Quality / accuracy","The output is inconsistent across the whole document.","I noticed significant inconsistencies throughout the document — I would appreciate a thorough review to ensure a uniform standard is applied."
"306","Quality / accuracy","This isn't the quality our clients expect from us.","I believe this deliverable needs further refinement before it meets the standard our clients expect, and I would like to discuss the necessary improvements."
"307","Quality / accuracy","You keep submitting incomplete work.","I have noticed a pattern of incomplete submissions and would like to discuss how we can ensure work is fully finalised before it is handed over."
"308","Quality / accuracy","There's no consistency in how the team does this.","I believe establishing clear quality standards and a consistent approach across the team would significantly improve the reliability of our output."
"309","Quality / accuracy","This calculation is wrong and it's going to the board.","I have identified an error in the calculation that needs to be corrected urgently before this material is presented to the board."
"310","Quality / accuracy","You copy and paste without checking if it's still correct.","I would appreciate a more thorough review process to ensure all content is verified for accuracy before being included in final documents."
"311","Quality / accuracy","The quality of your writing has dropped significantly.","I have noticed a decline in the quality of recent written outputs and would welcome a conversation about how I can support improvement."
"312","Quality / accuracy","You skipped the testing phase entirely.","I wanted to flag that the testing phase does not appear to have been completed — I would appreciate this being addressed before we proceed further."
"313","Quality / accuracy","This version has even more errors than the last one.","I noticed the number of errors appears to have increased in the latest version — I would like to discuss how we can improve the review process."
"314","Quality / accuracy","Your work requires constant correction from the rest of us.","I wanted to raise that a significant amount of time is being spent correcting outputs — I would like to explore how we can improve quality at the source."
"315","Quality / accuracy","You signed off on work that hasn't been tested.","I would like to discuss the sign-off process to ensure adequate testing is always completed before formal approval is given."
"316","Quality / accuracy","The formatting is completely inconsistent.","I would appreciate a review of the formatting to ensure it is consistent and aligned with our agreed standards throughout."
"317","Quality / accuracy","This report can't go to the client in this state.","I do not believe this report is ready for client distribution at this stage — I would like to agree on the revisions needed and a revised timeline."
"318","Quality / accuracy","Half the links in this document don't work.","I noticed several broken links in the document — could you please review and correct these before it is shared more widely?"
"319","Quality / accuracy","You used the wrong template again.","I noticed the incorrect template was used for this document — could you please reformat it using the correct version?"
"320","Quality / accuracy","This isn't accurate and it's going to mislead stakeholders.","I have identified some inaccuracies that could mislead stakeholders if not corrected — I would appreciate this being addressed before the document is circulated."
"321","Decision making","You made that decision without any input.","I believe a decision of this nature would benefit from broader consultation — I would appreciate being included in similar discussions going forward."
"322","Decision making","Nobody asked for our opinion and now we're stuck with this.","I would appreciate the opportunity to provide input on decisions that directly affect our team's work before they are finalised."
"323","Decision making","That was a terrible decision and everyone knows it.","I have some concerns about this decision and would welcome the opportunity to review the reasoning behind it and explore alternatives."
"324","Decision making","You keep changing your mind and we can't keep up.","I have noticed the direction has shifted several times recently, which makes it difficult to plan effectively — I would appreciate greater consistency in decision-making."
"325","Decision making","Nobody can make a decision around here.","I believe a clearer decision-making process would help us move forward more efficiently and reduce unnecessary delays."
"326","Decision making","You made the wrong call and now we're all paying for it.","I would like to have an open conversation about the decision and its impact, and discuss how we can course-correct effectively."
"327","Decision making","Stop overthinking it and just decide.","I would appreciate a decision on this matter so the team can proceed — I am happy to provide any additional information that might help."
"328","Decision making","That decision wasn't yours to make.","I wanted to flag that this decision may fall outside the agreed authority framework — I would appreciate a conversation about the appropriate process."
"329","Decision making","You ignored the data and went with your gut.","I would welcome a discussion about how we balance data-driven insights with experience in our decision-making process."
"330","Decision making","Why do decisions take so long here?","I believe streamlining our decision-making process would help us move forward more quickly and maintain momentum."
"331","Decision making","The decision was made before we even had a meeting.","I would appreciate decisions of this nature being kept open for discussion until the relevant parties have had the opportunity to contribute."
"332","Decision making","You reversed a decision without telling anyone.","I would appreciate being informed when decisions are revised, as it affects the team's planning and ongoing work."
"333","Decision making","That decision is going to backfire.","I have some concerns about the potential implications of this decision and would welcome a conversation about the risks before we proceed."
"334","Decision making","You shot down every idea without giving any reasons.","I would appreciate more detailed feedback when ideas are not taken forward, as it helps the team understand the decision and refine future proposals."
"335","Decision making","Nobody here knows how to make a tough call.","I believe introducing a clearer framework for navigating difficult decisions would help the team move forward with greater confidence."
"336","Decision making","You made a major decision based on incomplete information.","I would like to flag that the information available at the time of this decision may not have been sufficient — I would appreciate a review before we proceed further."
"337","Decision making","Why wasn't this escalated before a decision was made?","I believe a decision of this magnitude should have been escalated for broader input — I would like to discuss our escalation process going forward."
"338","Decision making","You always default to the safe option instead of the right one.","I would encourage a more evidence-based and outcomes-focused approach to decision-making that prioritises the best result over the most comfortable option."
"339","Decision making","This decision is going to have consequences nobody thought about.","I would like to flag some potential downstream implications of this decision that I think warrant consideration before we move forward."
"340","Decision making","You made a unilateral decision that affects the whole company.","I believe a decision with this level of impact should involve broader stakeholder consultation — I would welcome a discussion about the process used."
"341","Decision making","Nobody documented why that decision was made.","I would recommend documenting the rationale behind significant decisions so the team can refer back to them and ensure consistency going forward."
"342","Decision making","You always pick the most expensive option without justification.","I would appreciate a clear cost-benefit analysis to support significant spending decisions, so the team can evaluate options objectively."
"343","Decision making","That decision contradicts what we agreed last week.","I noticed this decision appears to conflict with what was agreed previously — could we clarify the current position so the team can align accordingly?"
"344","Decision making","You delegate decisions down but don't give people the authority to make them.","I believe ensuring that decision-making authority is clearly aligned with responsibility would help the team act more decisively and effectively."
"345","Decision making","Nobody followed the decision-making process we agreed on.","I would encourage adherence to our agreed decision-making process to ensure consistency, transparency, and appropriate governance."
"346","Decision making","You made a decision that goes against our strategy.","I would like to understand how this decision aligns with our overall strategic direction, as it appears to conflict with previously agreed priorities."
"347","Decision making","That decision was rushed and not properly thought through.","I believe this decision would benefit from further analysis and broader input before being finalised."
"348","Decision making","You excluded the people most affected by the decision.","I would recommend involving those most directly impacted in the decision-making process to ensure all relevant perspectives are considered."
"349","Decision making","Nobody owns this decision and it keeps getting delayed.","I believe assigning clear ownership of this decision would help us move forward and avoid further delays."
"350","Decision making","You changed the decision after it was communicated to the team.","I wanted to flag that a previously communicated decision appears to have changed — I would appreciate a formal update to ensure the team is realigned."
"351","Decision making","That decision makes no business sense.","I would welcome a conversation about the business rationale behind this decision to ensure I have the full context."
"352","Decision making","You decided without checking if it was even feasible.","I believe a feasibility assessment should be completed before decisions of this nature are finalised to avoid implementation challenges."
"353","Meetings / presentations","Your presentation was boring and went on forever.","I believe the presentation could benefit from a tighter structure and more concise delivery to better hold the audience's attention."
"354","Meetings / presentations","Nobody was engaged in that meeting.","I think a more interactive format and a clearer agenda might help increase engagement in future sessions."
"355","Meetings / presentations","You went completely off-topic for half the meeting.","I would suggest keeping future discussions more closely aligned to the agenda to ensure we make the most of the time available."
"356","Meetings / presentations","The slides were unreadable and unprofessional.","I believe the presentation materials could benefit from clearer formatting, improved readability, and a more polished visual design."
"357","Meetings / presentations","Why are we in a meeting that could have been an email?","I wanted to flag that some of the content covered today might be better suited to written communication — I would be happy to discuss the best format going forward."
"358","Meetings / presentations","You kept interrupting everyone.","I would appreciate an approach where each person is given the opportunity to finish their point before others respond."
"359","Meetings / presentations","The meeting had no clear outcome.","I believe future meetings would benefit from a defined objective and agreed action points to ensure they deliver tangible results."
"360","Meetings / presentations","You were completely unprepared.","I believe greater preparation before presentations or discussions would significantly strengthen the quality of our engagement."
"361","Meetings / presentations","Nobody leaves these meetings knowing what to do next.","I would suggest ensuring that clear and assigned action points are agreed upon at the end of each meeting to drive follow-through."
"362","Meetings / presentations","Your presentation had no clear message.","I believe the presentation would benefit from a clearer central narrative and a more defined call to action."
"363","Meetings / presentations","The meeting ran over by an hour for no reason.","I would appreciate more disciplined time management in our meetings to ensure they remain focused and end on schedule."
"364","Meetings / presentations","You presented the wrong data.","I noticed the data presented may not have been the most current version — I would appreciate a follow-up with the correct figures."
"365","Meetings / presentations","Nobody in that meeting knew what was going on.","I believe sharing a clear agenda and any relevant pre-reading in advance would help participants come better prepared."
"366","Meetings / presentations","Your delivery was terrible and hard to follow.","I believe the presentation delivery could benefit from a clearer structure and a more measured pace to improve clarity."
"367","Meetings / presentations","The Q&A was a disaster because you didn't prepare.","I think more thorough preparation for anticipated questions would help ensure a more confident and credible response during the Q&A."
"368","Meetings / presentations","You talked for 45 minutes and said nothing useful.","I believe focusing the presentation on two or three key messages would make it significantly more impactful and easier for the audience to retain."
"369","Meetings / presentations","Nobody was given a chance to speak in that meeting.","I would appreciate a more inclusive meeting format where all participants have the opportunity to contribute."
